{"schema_version":3,"seal_id":"seal_run_9029deeaa50949fd","run_id":"run_9029deeaa50949fd","context_digest":"sha256:c1ba5aae77b6698998329c0d99e0069015fff9ad4f4cdbe38f37df95dcb26848","gate_event_digest":"sha256:758341244b25bce3a1023eab7d15f451e3087581cde7414c056fbcdde3bffae3","gate_result_digest":"sha256:81974cde803873f08fcc5ffc57647e1db8c241335229ac0efdcf94bc85c28915","ledger_digest":"sha256:eba5105e65187756ee1c72e0bb0656d8cd439fb7f1dcbd80160404e4c8b7849e","manifest_digest":"sha256:c76cc58df843464b03b6e0147ea70d1f40d01f72b3cbae1c222df4e505f5fb59","seal_digest":"sha256:632bd01401cd460486258221670a992495d89e6bb0a0b111bd5e072d035d4a54"}