{"schema_version":3,"seal_id":"seal_run_95f5eeec43304235","run_id":"run_95f5eeec43304235","context_digest":"sha256:8dcea1f814f019e3055cd4073a754da8ae9efb952d1bfdae879d6506e7112098","gate_event_digest":"sha256:89eba2a807c24593dd1252f129f223e024a96be4a59f647d0f6bf14b7f182b7f","gate_result_digest":"sha256:1b083e23f20910126de4e5021d244a69300c2b97e3cd8494899cf6a546696318","ledger_digest":"sha256:877c01cccdb082606446d94452d0f3fe06b3d0e74827fa06888c4a1c492ad35e","manifest_digest":"sha256:e20e9441398c313fcce717ee411cad70a2100df820d9fdf0f005571a3b8c6712","seal_digest":"sha256:eaae608da28ea2f7f310e40fe80d3dd8d9cb2714d408407ff8e174d6c44fcff6"}