{"schema_version":3,"seal_id":"seal_run_22011485d59049d8","run_id":"run_22011485d59049d8","context_digest":"sha256:bc136653394eb0788408bede94efa70bb3c87547aad1239dd994293eb00daa0b","gate_event_digest":"sha256:2c4e923cc4bff2b2cd10d525dbb37ef25cd775a26f9088e2985539c43d45e2a2","gate_result_digest":"sha256:623914c71aa334847c10a8351d0f4ae81db7f702185c0fa938316c80682317be","ledger_digest":"sha256:6fe4a476e76094cc2af3d044e546dfdc9c01feac557d8ac4d6b29daff0e26dc9","manifest_digest":"sha256:2b350a0e7c01a6675f32431805445b21e0c45ba616acccdcce04b48851d3d8a0","seal_digest":"sha256:5b3fda09d2eef01f961d8e857ad6710faa1f44e9e0867f1059aa8183397445a3"}